{
  "capabilityLimits": [
    "Independent adversaries and writable repro isolation require observed authorized tools.",
    "Read-only review remains reduced and unrun suspicions are not verified findings.",
    "Unknown models do not establish diversity.",
    "The legacy reference files remain for staged-source accounting, not required rubric inputs.",
    "Neither host workflow has been observed for this overlay."
  ],
  "caseIds": [
    "adversarial-review"
  ],
  "dependencies": [
    "skills/arena/SKILL.md",
    "references/host-capabilities.md",
    "references/model-roles.md",
    "references/orchestration-contract.md"
  ],
  "inputs": [
    "Diff or files and surrounding context",
    "Stated intent paragraph",
    "Authorized reviewer selections and observed capabilities"
  ],
  "kind": "workflow",
  "name": "interrogate",
  "ordinaryExample": "An adversary reproduces a wrong null-input result in an isolated snapshot; the lead reruns it and drops a second claim that passes.",
  "outputs": [
    "Intent, Reviewers, Findings and Dropped, plus capability limits",
    "Exact snapshot, command, environment, output and lead rerun evidence",
    "Explicit unverified observations in reduced static review"
  ],
  "purpose": "Try to break a reviewed change in isolated copies and retain only findings proven by a lead rerun.",
  "sourcePaths": [
    "skills/interrogate/SKILL.md"
  ],
  "triggers": [
    "interrogate",
    "adversarial review",
    "multi-model review",
    "challenge this",
    "stress test this code",
    "find blind spots",
    "tear this apart"
  ]
}
