{
  "capabilityLimits": [
    "Unavailable or denied direct checks leave the affected outputs unverified.",
    "Preserve disable-model-invocation metadata without assuming host enforcement.",
    "Host behavior has not been tested."
  ],
  "caseIds": [
    "false-success"
  ],
  "dependencies": [
    "references/host-capabilities.md",
    "skills/show-me-your-work/SKILL.md"
  ],
  "inputs": [
    "task outputs and the real feature, process or stored value",
    "Available inspection and execution tools and permissions"
  ],
  "kind": "principle",
  "name": "principle-prove-it-works",
  "ordinaryExample": "After a feature compiles, run the feature and read its actual stored value before declaring it complete.",
  "outputs": [
    "Direct observations and visible verification artifacts",
    "Explicit unverified outputs when direct checks are unavailable"
  ],
  "purpose": "Verify task outputs against the real artifact before declaring completion.",
  "sourcePaths": [
    "skills/principle-prove-it-works/SKILL.md"
  ],
  "triggers": [
    "After completing a task, before declaring done"
  ]
}
