{
  "capabilityLimits": [
    "Absent workers require disclosed sequential exploration with reduced capability.",
    "Unavailable source leaves explicit gaps.",
    "Model selection follows observed session support; source-host defaults are not portable.",
    "Invocation metadata is preserved without claiming host enforcement.",
    "Host behavior has not been tested."
  ],
  "caseIds": [
    "trace-path"
  ],
  "dependencies": [
    "skills/how/references/explorer-prompt.md",
    "skills/how/references/explainer-prompt.md",
    "references/host-capabilities.md",
    "references/model-roles.md",
    "references/orchestration-contract.md"
  ],
  "inputs": [
    "Question and codebase",
    "Supplied execution path or subsystem scope",
    "Available read-only worker and source tools"
  ],
  "kind": "workflow",
  "name": "how",
  "ordinaryExample": "Trace an API request from its route through its service calls and storage layer, citing the files read.",
  "outputs": [
    "Overview, Key Concepts, How It Works, Where Things Live and Gotchas as applicable",
    "Actual files and functions, data flow, boundaries, diagrams when useful and explicit open questions"
  ],
  "purpose": "Explain subsystem architecture and runtime flow for a senior engineer using inspected code.",
  "sourcePaths": [
    "skills/how/SKILL.md",
    "skills/how/references/explainer-prompt.md",
    "skills/how/references/explorer-prompt.md"
  ],
  "triggers": [
    "how does X work",
    "Code walkthrough before a change",
    "Placement, ownership and layering questions"
  ]
}
