{
  "capabilityLimits": [
    "Missing provider, secure secret channel or network setup blocks execution.",
    "No credentials are mandatory for any other skill.",
    "Routine creation, installation, enrollment, listener exposure and network requests need explicit authorization.",
    "Canonical provider API and interface names describe source behavior; current host bindings require discovery.",
    "Host behavior is not-run; structural validation supplies no live-operation evidence."
  ],
  "caseIds": [
    "missing-webhook"
  ],
  "dependencies": [
    "references/host-capabilities.md",
    "references/workflow-ownership.md"
  ],
  "inputs": [
    "Explicit webhook provider, routine URL and agreed JSON fields.",
    "Secure secret submission and server-side retrieval channel.",
    "Authorized local execution and network setup."
  ],
  "kind": "skill",
  "name": "make-bot-ui",
  "ordinaryExample": "Design buttons that POST an agreed action to a local server, which wakes the configured bot routine without exposing its sender key.",
  "outputs": [
    "Local UI and server-side webhook protocol.",
    "Observed routine setup, harmless probe result and verified tailnet URLs when authorized and supported.",
    "Explicit execution block and setup checklist when capabilities are missing."
  ],
  "purpose": "Build a custom page whose local server wakes a bot routine over a webhook and optionally serves it on Tailscale.",
  "sourcePaths": [
    "skills/make-bot-ui/SKILL.md"
  ],
  "triggers": [
    "Make Bot UI or make-bot-ui invocation.",
    "Build a page, dashboard or buttons for a Grok Bot webhook.",
    "Securely provide a webhook sender key or expose the UI on Tailscale."
  ]
}
