{
  "capabilityLimits": [
    "No automatic tool installation or renderer download.",
    "Mappings execute JavaScript and require review and authorized isolation.",
    "No execution or PNG inspection means the dependent verification remains incomplete.",
    "Expected failures, unchecked rules and partial TLC output do not become a pass.",
    "Existing model mappings and worker lifecycle remain authoritative.",
    "Local helper checks do not prove host discovery or production correctness."
  ],
  "caseIds": [
    "statechart-from-spec",
    "statechart-from-chart",
    "statechart-blocked-tools",
    "statechart-execution-boundaries",
    "statechart-result-scope"
  ],
  "dependencies": [
    "references/host-capabilities.md",
    "references/workflow-ownership.md",
    "references/model-roles.md",
    "references/orchestration-contract.md",
    "skills/statechart/references/execution.md",
    "skills/statechart/scripts/statechart.mjs"
  ],
  "inputs": [
    "Existing code/spec or agreed Mermaid chart",
    "Authorized scratch, reviewed mappings, Java/TLC, local renderer and image inspection"
  ],
  "kind": "skill",
  "name": "statechart",
  "ordinaryExample": "Show why payment retries can charge twice, compare a modeled fix and reproduce the trace through a client entry point.",
  "outputs": [
    "Mermaid, PNG, stories and summary with checked-rule scope",
    "Real-code reproduction status, tool versions, bounds and explicit blockers"
  ],
  "purpose": "Draw user-facing charts and counterexample stories from a TLA+ model, or check an agreed chart.",
  "sourcePaths": [
    "skills/statechart/SKILL.md",
    "skills/statechart/scripts/chart-to-tla.mjs",
    "skills/statechart/scripts/compare-charts.mjs",
    "skills/statechart/scripts/lib.mjs",
    "skills/statechart/scripts/model/OutputFolder.cfg",
    "skills/statechart/scripts/model/OutputFolder.map.mjs",
    "skills/statechart/scripts/model/OutputFolder.tla",
    "skills/statechart/scripts/statechart.mjs",
    "skills/statechart/scripts/test/statechart.test.mjs",
    "skills/statechart/scripts/test/sync.mmd",
    "skills/statechart/scripts/test/upload.mmd",
    "skills/statechart/scripts/tlc-to-chart.mjs"
  ],
  "triggers": [
    "/statechart",
    "show modeled behavior and counterexamples"
  ]
}
